{
  "completed_at": "2026-08-28T19:56:35Z",
  "event_sequence": 3,
  "execution_id": "chatgpt-node-fmt2-20260828T2004Z",
  "recorded_at": "2026-08-28T19:56:35Z",
  "schema": "zero3.commander.result/2.0",
  "state": "succeeded",
  "summary": {
    "events": [
      {
        "created_at": "2026-08-28T19:56:16Z",
        "event_sequence": 1,
        "event_type": "task.started",
        "payload": {
          "capability": "test.fmt"
        }
      },
      {
        "created_at": "2026-08-28T19:56:16Z",
        "event_sequence": 2,
        "event_type": "task.output",
        "payload": {
          "command": [
            "cargo",
            "fmt",
            "--all",
            "--",
            "--check"
          ],
          "returncode": 0,
          "stderr": "",
          "stdout": ""
        }
      },
      {
        "created_at": "2026-08-28T19:56:16Z",
        "event_sequence": 3,
        "event_type": "task.succeeded",
        "payload": {
          "returncode": 0
        }
      }
    ],
    "executions": [
      {
        "attempt_generation": 1,
        "progress": 1.0,
        "stage": "test.fmt"
      }
    ]
  },
  "task_id": "pilot-task-5023129456664dcc",
  "terminal": true
}
