{
  "completed_at": "2026-08-28T14:40:32Z",
  "event_sequence": 2,
  "execution_id": "chatgpt-canary-20260828T143948Z-1a7d6b",
  "recorded_at": "2026-08-28T14:40:32Z",
  "schema": "zero3.commander.result/2.0",
  "state": "succeeded",
  "summary": {
    "events": [
      {
        "created_at": "2026-08-28T14:40:14Z",
        "event_sequence": 1,
        "event_type": "task.started",
        "payload": {
          "capability": "git.create_branch"
        }
      },
      {
        "created_at": "2026-08-28T14:40:15Z",
        "event_sequence": 2,
        "event_type": "task.succeeded",
        "payload": {
          "returncode": 0
        }
      }
    ],
    "executions": [
      {
        "attempt_generation": 1,
        "progress": 1.0,
        "stage": "git.create_branch"
      }
    ]
  },
  "task_id": "pilot-task-b1e810fe192940ee",
  "terminal": true
}
