{
  "completed_at": "2026-08-29T01:37:33Z",
  "event_sequence": 3,
  "execution_id": "chatgpt-router-reset-remote-20260829T0137Z",
  "recorded_at": "2026-08-29T01:37:33Z",
  "schema": "zero3.commander.result/2.0",
  "state": "succeeded",
  "summary": {
    "events": [
      {
        "created_at": "2026-08-29T01:37:14Z",
        "event_sequence": 1,
        "event_type": "task.started",
        "payload": {
          "capability": "repo.checkout"
        }
      },
      {
        "created_at": "2026-08-29T01:37:15Z",
        "event_sequence": 2,
        "event_type": "task.output",
        "payload": {
          "command": [
            "git",
            "checkout",
            "-B",
            "pilot-dev-router-skills-20260829",
            "origin/pilot-dev-router-skills-20260829"
          ],
          "returncode": 0,
          "stderr": "Reset branch 'pilot-dev-router-skills-20260829'\n",
          "stdout": "M\tapps/node/src/main.rs\nBranch 'pilot-dev-router-skills-20260829' set up to track remote branch 'pilot-dev-router-skills-20260829' from 'origin'.\nYour branch is up to date with 'origin/pilot-dev-router-skills-20260829'.\n"
        }
      },
      {
        "created_at": "2026-08-29T01:37:15Z",
        "event_sequence": 3,
        "event_type": "task.succeeded",
        "payload": {
          "returncode": 0
        }
      }
    ],
    "executions": [
      {
        "attempt_generation": 1,
        "progress": 1.0,
        "stage": "repo.checkout"
      }
    ]
  },
  "task_id": "pilot-task-0e1fdf8a45654753",
  "terminal": true
}
