{
  "completed_at": "2026-08-29T02:20:06Z",
  "event_sequence": 3,
  "execution_id": "chatgpt-router-remove-route-imports-20260829T0234Z",
  "recorded_at": "2026-08-29T02:20:06Z",
  "schema": "zero3.commander.result/2.0",
  "state": "succeeded",
  "summary": {
    "events": [
      {
        "created_at": "2026-08-29T02:20:06Z",
        "event_sequence": 1,
        "event_type": "task.started",
        "payload": {
          "capability": "file.patch"
        }
      },
      {
        "created_at": "2026-08-29T02:20:06Z",
        "event_sequence": 2,
        "event_type": "task.output",
        "payload": {
          "command": [
            "git",
            "apply",
            "--whitespace=nowarn",
            "/opt/zero3-pilot-dev/tmpq95vig6z.patch"
          ],
          "returncode": 0,
          "stderr": "",
          "stdout": ""
        }
      },
      {
        "created_at": "2026-08-29T02:20:06Z",
        "event_sequence": 3,
        "event_type": "task.succeeded",
        "payload": {
          "returncode": 0
        }
      }
    ],
    "executions": [
      {
        "attempt_generation": 1,
        "progress": 1.0,
        "stage": "file.patch"
      }
    ]
  },
  "task_id": "pilot-task-25fad4bd24704d7b",
  "terminal": true
}
