{
  "completed_at": "2026-08-28T16:37:16Z",
  "event_sequence": 2,
  "execution_id": "chatgpt-autonomy-push-20260828T1638Z",
  "recorded_at": "2026-08-28T16:37:16Z",
  "schema": "zero3.commander.result/2.0",
  "state": "succeeded",
  "summary": {
    "events": [
      {
        "created_at": "2026-08-28T16:36:57Z",
        "event_sequence": 1,
        "event_type": "task.started",
        "payload": {
          "capability": "git.push_branch"
        }
      },
      {
        "created_at": "2026-08-28T16:36:59Z",
        "event_sequence": 2,
        "event_type": "task.succeeded",
        "payload": {
          "returncode": 0
        }
      }
    ],
    "executions": [
      {
        "attempt_generation": 1,
        "progress": 1.0,
        "stage": "git.push_branch"
      }
    ]
  },
  "task_id": "pilot-task-2e3cce3914af4f94",
  "terminal": true
}
