{
  "completed_at": "2026-08-28T20:38:58Z",
  "event_sequence": 3,
  "execution_id": "chatgpt-final-repo-fetch-20260828T2038Z",
  "recorded_at": "2026-08-28T20:38:58Z",
  "schema": "zero3.commander.result/2.0",
  "state": "succeeded",
  "summary": {
    "events": [
      {
        "created_at": "2026-08-28T20:38:39Z",
        "event_sequence": 1,
        "event_type": "task.started",
        "payload": {
          "capability": "repo.fetch"
        }
      },
      {
        "created_at": "2026-08-28T20:38:40Z",
        "event_sequence": 2,
        "event_type": "task.output",
        "payload": {
          "command": [
            "git",
            "fetch",
            "origin"
          ],
          "returncode": 0,
          "stderr": "From github.com:Taa965/zero3-pilot\n   6cc01fd..17d638f  main       -> origin/main\n",
          "stdout": ""
        }
      },
      {
        "created_at": "2026-08-28T20:38:40Z",
        "event_sequence": 3,
        "event_type": "task.succeeded",
        "payload": {
          "returncode": 0
        }
      }
    ],
    "executions": [
      {
        "attempt_generation": 1,
        "progress": 1.0,
        "stage": "repo.fetch"
      }
    ]
  },
  "task_id": "pilot-task-f5ab8d11eb6e47b5",
  "terminal": true
}
