{
  "completed_at": "2026-08-29T00:54:56Z",
  "event_sequence": 3,
  "execution_id": "chatgpt-installer-weixin-return-main-20260829T0055Z",
  "recorded_at": "2026-08-29T00:54:56Z",
  "schema": "zero3.commander.result/2.0",
  "state": "succeeded",
  "summary": {
    "events": [
      {
        "created_at": "2026-08-29T00:54:37Z",
        "event_sequence": 1,
        "event_type": "task.started",
        "payload": {
          "capability": "repo.checkout"
        }
      },
      {
        "created_at": "2026-08-29T00:54:38Z",
        "event_sequence": 2,
        "event_type": "task.output",
        "payload": {
          "command": [
            "git",
            "checkout",
            "-B",
            "main",
            "origin/main"
          ],
          "returncode": 0,
          "stderr": "Switched to and reset branch 'main'\n",
          "stdout": "Branch 'main' set up to track remote branch 'main' from 'origin'.\nYour branch is up to date with 'origin/main'.\n"
        }
      },
      {
        "created_at": "2026-08-29T00:54:38Z",
        "event_sequence": 3,
        "event_type": "task.succeeded",
        "payload": {
          "returncode": 0
        }
      }
    ],
    "executions": [
      {
        "attempt_generation": 1,
        "progress": 1.0,
        "stage": "repo.checkout"
      }
    ]
  },
  "task_id": "pilot-task-3c0904ae227c4cae",
  "terminal": true
}
