{
  "completed_at": "2026-08-28T21:19:54Z",
  "event_sequence": 2,
  "execution_id": "chatgpt-installer-weixin-final-polish-20260828T2120Z",
  "recorded_at": "2026-08-28T21:19:54Z",
  "schema": "zero3.commander.result/2.0",
  "state": "failed",
  "summary": {
    "events": [
      {
        "created_at": "2026-08-28T21:19:54Z",
        "event_sequence": 1,
        "event_type": "task.started",
        "payload": {
          "capability": "file.patch"
        }
      },
      {
        "created_at": "2026-08-28T21:19:54Z",
        "event_sequence": 2,
        "event_type": "task.failed",
        "payload": {
          "reason": "command failed with exit 128: ['git', 'apply', '--whitespace=nowarn', '/opt/zero3-pilot-dev/tmpre3bedae.patch']\nstderr:\nerror: corrupt patch at line 25\n"
        }
      }
    ],
    "executions": [
      {
        "attempt_generation": 1,
        "progress": 0.0,
        "stage": "file.patch"
      }
    ]
  },
  "task_id": "pilot-task-d9348d390d9e48da",
  "terminal": true
}
