{
  "completed_at": "2026-08-28T20:23:08Z",
  "event_sequence": 3,
  "execution_id": "chatgpt-final-clippy-20260828T2023Z",
  "recorded_at": "2026-08-28T20:23:08Z",
  "schema": "zero3.commander.result/2.0",
  "state": "succeeded",
  "summary": {
    "events": [
      {
        "created_at": "2026-08-28T20:22:49Z",
        "event_sequence": 1,
        "event_type": "task.started",
        "payload": {
          "capability": "test.clippy"
        }
      },
      {
        "created_at": "2026-08-28T20:22:53Z",
        "event_sequence": 2,
        "event_type": "task.output",
        "payload": {
          "command": [
            "cargo",
            "clippy",
            "--workspace",
            "--all-targets",
            "--",
            "-D",
            "warnings"
          ],
          "returncode": 0,
          "stderr": "    Checking zero3-providers v0.1.0 (/opt/zero3-pilot-dev/crates/zero3-providers)\n    Checking zero3-node v0.1.0 (/opt/zero3-pilot-dev/apps/node)\n    Finished `dev` profile [unoptimized + debuginfo] target(s) in 3.45s\n",
          "stdout": ""
        }
      },
      {
        "created_at": "2026-08-28T20:22:53Z",
        "event_sequence": 3,
        "event_type": "task.succeeded",
        "payload": {
          "returncode": 0
        }
      }
    ],
    "executions": [
      {
        "attempt_generation": 1,
        "progress": 1.0,
        "stage": "test.clippy"
      }
    ]
  },
  "task_id": "pilot-task-0c0b110282d34d40",
  "terminal": true
}
