{
  "completed_at": "2026-08-28T21:14:00Z",
  "event_sequence": 2,
  "execution_id": "chatgpt-weixin-windows-persist-20260828T2114Z",
  "recorded_at": "2026-08-28T21:14:00Z",
  "schema": "zero3.commander.result/2.0",
  "state": "failed",
  "summary": {
    "events": [
      {
        "created_at": "2026-08-28T21:14:00Z",
        "event_sequence": 1,
        "event_type": "task.started",
        "payload": {
          "capability": "file.patch"
        }
      },
      {
        "created_at": "2026-08-28T21:14:00Z",
        "event_sequence": 2,
        "event_type": "task.failed",
        "payload": {
          "reason": "command failed with exit 1: ['git', 'apply', '--whitespace=nowarn', '/opt/zero3-pilot-dev/tmp751ezi23.patch']\nstderr:\nerror: patch failed: crates/zero3-providers/src/weixin_clawbot.rs:486\nerror: crates/zero3-providers/src/weixin_clawbot.rs: patch does not apply\n"
        }
      }
    ],
    "executions": [
      {
        "attempt_generation": 1,
        "progress": 0.0,
        "stage": "file.patch"
      }
    ]
  },
  "task_id": "pilot-task-85e852204ce64774",
  "terminal": true
}
