{
  "completed_at": "2026-08-29T00:39:28Z",
  "event_sequence": 3,
  "execution_id": "chatgpt-weixin-summary-push-20260829T0039Z",
  "recorded_at": "2026-08-29T00:39:28Z",
  "schema": "zero3.commander.result/2.0",
  "state": "succeeded",
  "summary": {
    "events": [
      {
        "created_at": "2026-08-29T00:39:09Z",
        "event_sequence": 1,
        "event_type": "task.started",
        "payload": {
          "capability": "git.push_branch"
        }
      },
      {
        "created_at": "2026-08-29T00:39:11Z",
        "event_sequence": 2,
        "event_type": "task.output",
        "payload": {
          "command": [
            "git",
            "push",
            "origin",
            "HEAD:refs/heads/pilot-dev-installer-weixin-20260829"
          ],
          "returncode": 0,
          "stderr": "To github.com:Taa965/zero3-pilot.git\n   11278a3..8397d4e  HEAD -> pilot-dev-installer-weixin-20260829\n",
          "stdout": ""
        }
      },
      {
        "created_at": "2026-08-29T00:39:11Z",
        "event_sequence": 3,
        "event_type": "task.succeeded",
        "payload": {
          "returncode": 0
        }
      }
    ],
    "executions": [
      {
        "attempt_generation": 1,
        "progress": 1.0,
        "stage": "git.push_branch"
      }
    ]
  },
  "task_id": "pilot-task-d615c92adaa749cc",
  "terminal": true
}
