{
  "completed_at": "2026-08-28T16:34:44Z",
  "event_sequence": 2,
  "execution_id": "chatgpt-autonomy-test-20260828T1635Z",
  "recorded_at": "2026-08-28T16:34:44Z",
  "schema": "zero3.commander.result/2.0",
  "state": "succeeded",
  "summary": {
    "events": [
      {
        "created_at": "2026-08-28T16:34:26Z",
        "event_sequence": 1,
        "event_type": "task.started",
        "payload": {
          "capability": "test.run"
        }
      },
      {
        "created_at": "2026-08-28T16:34:27Z",
        "event_sequence": 2,
        "event_type": "task.succeeded",
        "payload": {
          "returncode": 0
        }
      }
    ],
    "executions": [
      {
        "attempt_generation": 1,
        "progress": 1.0,
        "stage": "test.run"
      }
    ]
  },
  "task_id": "pilot-task-fe37fcfabc244057",
  "terminal": true
}
