{
  "completed_at": "2026-08-28T18:33:54Z",
  "event_sequence": 3,
  "execution_id": "chatgpt-ocu-clippy2-20260828T1837Z",
  "recorded_at": "2026-08-28T18:33:54Z",
  "schema": "zero3.commander.result/2.0",
  "state": "succeeded",
  "summary": {
    "events": [
      {
        "created_at": "2026-08-28T18:33:35Z",
        "event_sequence": 1,
        "event_type": "task.started",
        "payload": {
          "capability": "test.clippy"
        }
      },
      {
        "created_at": "2026-08-28T18:33:37Z",
        "event_sequence": 2,
        "event_type": "task.output",
        "payload": {
          "command": [
            "cargo",
            "clippy",
            "--workspace",
            "--all-targets",
            "--",
            "-D",
            "warnings"
          ],
          "returncode": 0,
          "stderr": "    Checking zero3-providers v0.1.0 (/opt/zero3-pilot-dev/crates/zero3-providers)\n   Compiling zero3-web v0.1.0 (/opt/zero3-pilot-dev/apps/web)\n    Finished `dev` profile [unoptimized + debuginfo] target(s) in 1.69s\n",
          "stdout": ""
        }
      },
      {
        "created_at": "2026-08-28T18:33:37Z",
        "event_sequence": 3,
        "event_type": "task.succeeded",
        "payload": {
          "returncode": 0
        }
      }
    ],
    "executions": [
      {
        "attempt_generation": 1,
        "progress": 1.0,
        "stage": "test.clippy"
      }
    ]
  },
  "task_id": "pilot-task-422e546f1733478a",
  "terminal": true
}
