{
  "completed_at": "2026-08-28T21:21:31Z",
  "event_sequence": 2,
  "execution_id": "chatgpt-weixin-formatter-harness-20260828T2122Z",
  "recorded_at": "2026-08-28T21:21:31Z",
  "schema": "zero3.commander.result/2.0",
  "state": "succeeded",
  "summary": {
    "events": [
      {
        "created_at": "2026-08-28T21:21:31Z",
        "event_sequence": 1,
        "event_type": "task.started",
        "payload": {
          "capability": "file.write"
        }
      },
      {
        "created_at": "2026-08-28T21:21:31Z",
        "event_sequence": 2,
        "event_type": "task.succeeded",
        "payload": {
          "returncode": null
        }
      }
    ],
    "executions": [
      {
        "attempt_generation": 1,
        "progress": 1.0,
        "stage": "file.write"
      }
    ]
  },
  "task_id": "pilot-task-77433c025ada4e35",
  "terminal": true
}
