{
  "completed_at": "2026-08-28T19:59:15Z",
  "event_sequence": 3,
  "execution_id": "chatgpt-node-push1-20260828T2008Z",
  "recorded_at": "2026-08-28T19:59:15Z",
  "schema": "zero3.commander.result/2.0",
  "state": "succeeded",
  "summary": {
    "events": [
      {
        "created_at": "2026-08-28T19:58:56Z",
        "event_sequence": 1,
        "event_type": "task.started",
        "payload": {
          "capability": "git.push_branch"
        }
      },
      {
        "created_at": "2026-08-28T19:58:57Z",
        "event_sequence": 2,
        "event_type": "task.output",
        "payload": {
          "command": [
            "git",
            "push",
            "origin",
            "HEAD:refs/heads/pilot-dev-node-desktop-20260829"
          ],
          "returncode": 0,
          "stderr": "To github.com:Taa965/zero3-pilot.git\n   a446887..7f93989  HEAD -> pilot-dev-node-desktop-20260829\n",
          "stdout": ""
        }
      },
      {
        "created_at": "2026-08-28T19:58:57Z",
        "event_sequence": 3,
        "event_type": "task.succeeded",
        "payload": {
          "returncode": 0
        }
      }
    ],
    "executions": [
      {
        "attempt_generation": 1,
        "progress": 1.0,
        "stage": "git.push_branch"
      }
    ]
  },
  "task_id": "pilot-task-e522797d75714beb",
  "terminal": true
}
