{
  "completed_at": "2026-08-28T17:56:34Z",
  "event_sequence": 3,
  "execution_id": "chatgpt-format-refresh-20260828T1759Z",
  "recorded_at": "2026-08-28T17:56:34Z",
  "schema": "zero3.commander.result/2.0",
  "state": "succeeded",
  "summary": {
    "events": [
      {
        "created_at": "2026-08-28T17:56:16Z",
        "event_sequence": 1,
        "event_type": "task.started",
        "payload": {
          "capability": "repo.checkout"
        }
      },
      {
        "created_at": "2026-08-28T17:56:17Z",
        "event_sequence": 2,
        "event_type": "task.output",
        "payload": {
          "command": [
            "git",
            "checkout",
            "-B",
            "pilot-dev-complete-runtime-20260829",
            "origin/pilot-dev-complete-runtime-20260829"
          ],
          "returncode": 0,
          "stderr": "Reset branch 'pilot-dev-complete-runtime-20260829'\n",
          "stdout": "Branch 'pilot-dev-complete-runtime-20260829' set up to track remote branch 'pilot-dev-complete-runtime-20260829' from 'origin'.\nYour branch is up to date with 'origin/pilot-dev-complete-runtime-20260829'.\n"
        }
      },
      {
        "created_at": "2026-08-28T17:56:17Z",
        "event_sequence": 3,
        "event_type": "task.succeeded",
        "payload": {
          "returncode": 0
        }
      }
    ],
    "executions": [
      {
        "attempt_generation": 1,
        "progress": 1.0,
        "stage": "repo.checkout"
      }
    ]
  },
  "task_id": "pilot-task-77fa21252e9f4055",
  "terminal": true
}
