{
  "completed_at": "2026-08-29T02:13:29Z",
  "event_sequence": 2,
  "execution_id": "chatgpt-router-node-clean-imports2-20260829T0221Z",
  "recorded_at": "2026-08-29T02:13:29Z",
  "schema": "zero3.commander.result/2.0",
  "state": "failed",
  "summary": {
    "events": [
      {
        "created_at": "2026-08-29T02:13:29Z",
        "event_sequence": 1,
        "event_type": "task.started",
        "payload": {
          "capability": "file.patch"
        }
      },
      {
        "created_at": "2026-08-29T02:13:29Z",
        "event_sequence": 2,
        "event_type": "task.failed",
        "payload": {
          "reason": "command failed with exit 1: ['git', 'apply', '--whitespace=nowarn', '/opt/zero3-pilot-dev/tmpmrftuu6q.patch']\nstderr:\nerror: patch failed: apps/node/src/main.rs:39\nerror: apps/node/src/main.rs: patch does not apply\n"
        }
      }
    ],
    "executions": [
      {
        "attempt_generation": 1,
        "progress": 0.0,
        "stage": "file.patch"
      }
    ]
  },
  "task_id": "pilot-task-bcc0bab9f03443d5",
  "terminal": true
}
